21|Supplier#000000021|81CavellcrJ0PQ3CPBID0Z0JwyJm0ka5igEs|2|12-253-590-5816|9365.80|d. instructions integrate sometimes slyly pending instructions. accounts nag among the 
22|Supplier#000000022|okiiQFk 8lm6EVX6Q0,bEcO|4|14-144-830-2814|-966.20| ironically among the deposits. closely expre
23|Supplier#000000023|ssetugTcXc096qlD7 2TL5crEEeS3zk|9|19-559-422-5776|5926.41|ges could have to are ironic deposits. regular, even request
24|Supplier#000000024|C4nPvLrVmKPPabFCj|0|10-620-939-2254|9170.71|usly pending deposits. slyly final accounts run 
25|Supplier#000000025|RCQKONXMFnrodzz6w7fObFVV6CUm2q|22|32-431-945-3541|9198.31|ely regular deposits. carefully regular sauternes engage furiously above the regular accounts. idly 
26|Supplier#000000026|iV,MHzAx6Z939uzFNkq09M0a1 MBfH7|21|31-758-894-4436|21.18| ideas poach carefully after the blithely bold asymptotes. furiously pending theodoli
27|Supplier#000000027|lC4CjKwNHUr6L4xIpzOBK4NlHkFTg|18|28-708-999-2028|1887.62|s according to the quickly regular hockey playe
28|Supplier#000000028|GBhvoRh,7YIN V|0|10-538-384-8460|-891.99|ld requests across the pinto beans are carefully against the quickly final courts. accounts sleep 
29|Supplier#000000029|658tEqXLPvRd6xpFdqC2|1|11-555-705-5922|-811.62|y express ideas play furiously. even accounts sleep fluffily across the accounts. careful
30|Supplier#000000030|84NmC1rmQfO0fj3zkobLT|16|26-940-594-4852|8080.14|ias. carefully silent accounts cajole blithely. pending, special accounts cajole quickly above the f
31|Supplier#000000031|fRJimA7zchyApqRLHcQeocVpP|16|26-515-530-4159|5916.91|into beans wake after the special packages. slyly fluffy requests cajole furio
32|Supplier#000000032|yvoD3TtZSx1skQNCK8agk5bZlZLug|23|33-484-637-7873|3556.47|usly even depths. quickly ironic theodolites s
33|Supplier#000000033|gfeKpYw3400L0SDywXA6Ya1Qmq1w6YB9f3R|7|17-138-897-9374|8564.12|n sauternes along the regular asymptotes are regularly along the 
34|Supplier#000000034|mYRe3KvA2O4lL4HhxDKkkrPUDPMKRCSp,Xpa|10|20-519-982-2343|237.31|eposits. slyly final deposits toward the slyly regular dependencies sleep among the excu
35|Supplier#000000035|QymmGXxjVVQ5OuABCXVVsu,4eF gU0Qc6|21|31-720-790-5245|4381.41| ironic deposits! final, bold platelets haggle quickly quickly pendin
36|Supplier#000000036|mzSpBBJvbjdx3UKTW3bLFewRD78D91lAC879|13|23-273-493-3679|2371.51|ular theodolites must haggle regular, bold accounts. slyly final pinto beans bo
37|Supplier#000000037|cqjyB5h1nV|0|10-470-144-1330|3017.47|iously final instructions. quickly special accounts hang fluffily above the accounts. deposits
38|Supplier#000000038|xEcx45vD0FXHT7c9mvWFY|4|14-361-296-6426|2512.41|ins. fluffily special accounts haggle slyly af
39|Supplier#000000039|ZM, nSYpEPWr1yAFHaC91qjFcijjeU5eH|8|18-851-856-5633|6115.65|le slyly requests. special packages shall are blithely. slyly unusual packages sleep 
40|Supplier#000000040|zyIeWzbbpkTV37vm1nmSGBxSgd2Kp|22|32-231-247-6991|-290.06| final patterns. accounts haggle idly pas
